{
  "$schema": "https://json-schema.org/draft/2020-12/schema", "$id": "urn:az305:schema:validation:1.0.0", "type": "object", "additionalProperties": false,
  "required": ["schemaVersion", "labId", "runId", "mode", "result", "validatedAt", "assertions"],
  "properties": {"_generatedBegin": {"const": "BEGIN GENERATED AZ305 V1"}, "_generatedEnd": {"const": "END GENERATED AZ305 V1"}, "schemaVersion": {"const": "1.0.0"}, "labId": {"pattern": "^LAB-[0-2][0-9]$"}, "runId": {"type": "string"}, "mode": {"enum": ["Deployment", "PostCleanup"]}, "result": {"enum": ["pass", "partial", "fail"]}, "validatedAt": {"type": "string", "format": "date-time"}, "assertions": {"type": "array", "minItems": 1, "items": {"type": "object", "additionalProperties": false, "required": ["id", "kind", "passed", "message"], "properties": {"id": {"type": "string"}, "kind": {"enum": ["positive", "negative"]}, "passed": {"type": "boolean"}, "message": {"type": "string"}}}}}
}
