{
  "_generatedBegin": "BEGIN GENERATED AZ305 V1",
  "schemaVersion": "1.0.0",
  "labId": "LAB-19",
  "runId": "synthetic-190001",
  "mode": "PostCleanup",
  "result": "pass",
  "validatedAt": "2026-09-02T00:00:00Z",
  "assertions": [
    {
      "id": "LAB19-FIX-POS",
      "kind": "positive",
      "passed": true,
      "message": "Synthetic cleanup fixture is schema valid."
    },
    {
      "id": "LAB19-FIX-NEG",
      "kind": "negative",
      "passed": true,
      "message": "Synthetic fixture records no active managed object."
    }
  ]
  ,"_generatedEnd": "END GENERATED AZ305 V1"
}
